program,academic_year,major,last_name,first_name,email,phone,company,company_address,master_last,master_first,master_email,master_phone,master_position,mission_keywords,mission_profession,mission_comments,visit_date,visit_format,visit_comments,report_theme,report_grade,report_comments,oral_date,oral_grade,oral_comments,comments,tutor_feedback
Cycle Ingénieur,2024-2025,I2,Hamilton,Lewis,lewis.hamilton@efrei.fr,0711111111,FormulaTech,"10 Circuit Road, Monaco",Spielberg,Steven,steven.spielberg@f1tech.com,0701111111,Chef de projet,"Microservices,Docker",Développeur backend,Participation active au projet,2025-03-15,FACE_TO_FACE,Visite sur site et suivi de mission,Optimisation microservices,17.0,Travail très bien structuré,2025-06-12,16.5,Excellente prestation,Très motivé et autonome,Bon suivi
Cycle Ingénieur,2024-2025,I2,Swift,Taylor,taylor.swift@efrei.fr,0722222222,InnovaTech,"22 Avenue Victor Hugo, Lyon",Nolan,Christopher,christopher.nolan@innovatech.com,0702222222,Responsable IA,IA,Data scientist,Analyse des modèles ML,2025-04-18,VIDEOCONFERENCE,Bien préparée et ponctuelle,Analyse prédictive,15.5,Bonne approche scientifique,2025-06-18,15.0,Soutenance correcte,Travail sérieux et appliqué,Bonne progression
Cycle Ingénieur,2024-2025,I2,Beckham,David,david.beckham@efrei.fr,0733333333,SoftWorks,"5 Rue des Lilas, Toulouse",Tarantino,Quentin,quentin.tarantino@softworks.com,0703333333,Tech Lead,Docker,DevOps Engineer,Mise en place de pipelines automatisés,2025-05-02,FACE_TO_FACE,Retour détaillé sur le workflow,Optimisation workflow IA,16.5,Très bon niveau technique,2025-06-20,16.0,Bien présenté,Très investi dans les tâches techniques,Bien encadré
Cycle Ingénieur,2024-2025,I2,Monroe,Marilyn,marilyn.monroe@efrei.fr,0744444444,GreenByte,"78 Rue Verte, Lille",Hanks,Tom,tom.hanks@greenbyte.com,0704444444,Manager IT,Cybersecurity,Ingénieur sécurité,Bonne rigueur dans les tests,2025-04-22,VIDEOCONFERENCE,Rappel des objectifs et suivi,Protection web apps,18.0,Présentation claire et pertinente,2025-06-22,17.5,Excellente maîtrise du sujet,Participation active en équipe,Communication fluide
Cycle Ingénieur,2024-2025,I2,Jordan,Michael,michael.jordan@efrei.fr,0755555555,CyberNova,"5 Rue du Numérique, Bordeaux",DiCaprio,Leonardo,leonardo.dicaprio@cybernova.com,0705555555,Architecte logiciel,AWS,Cloud Architect,Excellente compréhension des architectures,2025-04-25,FACE_TO_FACE,Rencontre sur site avec démonstration,Déploiement cloud,14.5,Projet bien mené mais à approfondir,2025-06-25,14.0,Peut mieux structurer son discours,Bon potentiel technique,Peut améliorer la gestion du temps